{
  "blocks": [
    {
      "text": {
        "text": "AI Provider Watch",
        "type": "plain_text"
      },
      "type": "header"
    },
    {
      "elements": [
        {
          "text": "5 event(s) | since 2024-01-01 | risk medium",
          "type": "mrkdwn"
        }
      ],
      "type": "context"
    },
    {
      "type": "divider"
    },
    {
      "text": {
        "text": "*Anthropic Scheduled Claude Opus 4.1 API Retirement For August 2026*\n`high` `model_retirement` `2026-06-05`\nAnthropic's Claude Platform release notes announced deprecation of claude-opus-4-1-20250805 and scheduled Claude API retirement for August 5, 2026, with migration guidance toward newer Opus models.\nRefs: provider:anthropic",
        "type": "mrkdwn"
      },
      "type": "section"
    },
    {
      "type": "divider"
    },
    {
      "text": {
        "text": "*Google Gemini API Shut Down Gemini 2.0 Flash Models*\n`high` `model_retirement` `2026-06-01`\nGoogle Gemini API changelog records the June 1, 2026 shutdown of Gemini 2.0 Flash and Gemini 2.0 Flash-Lite model IDs on the Gemini API surface.\nRefs: provider:google",
        "type": "mrkdwn"
      },
      "type": "section"
    },
    {
      "type": "divider"
    },
    {
      "text": {
        "text": "*Google Vertex AI Retires Gemini 2.0 Flash Stable Models*\n`medium` `model_retirement` `2026-06-01`\nGoogle Vertex AI model-version documentation lists Gemini 2.0 Flash stable model IDs with a June 1, 2026 retirement date and points developers toward newer Gemini stable models.\nRefs: provider:google",
        "type": "mrkdwn"
      },
      "type": "section"
    },
    {
      "type": "divider"
    },
    {
      "text": {
        "text": "*Google Gemini API Shut Down Gemini 3.1 Flash-Lite Preview*\n`medium` `model_retirement` `2026-05-25`\nGoogle Gemini API changelog records the shutdown of the Gemini 3.1 Flash-Lite preview model and directs developers to the generally available Gemini 3.1 Flash-Lite model.\nRefs: provider:google",
        "type": "mrkdwn"
      },
      "type": "section"
    },
    {
      "type": "divider"
    },
    {
      "text": {
        "text": "*OpenAI Scheduled Legacy GPT And Codex Snapshot Retirements For July And October 2026*\n`high` `model_retirement` `2026-04-22`\nOpenAI's deprecations table schedules shutdowns for older GPT, Codex, search, audio, realtime, and reasoning model snapshots beginning July 23, 2026, with additional legacy GPT snapshot removals on October 23, 2026.\nRefs: provider:openai",
        "type": "mrkdwn"
      },
      "type": "section"
    }
  ],
  "delivery": {
    "idempotency_key": "apw-slack-v0-4b52f3a850d77ab6122c27de",
    "mode": "operator_owned",
    "requires_operator_owned_webhook_url": true,
    "retry_policy": {
      "backoff": "exponential_jitter",
      "max_attempts": 3,
      "non_retryable_status": "400-499 except 408 and 429",
      "retry_on_status": [
        408,
        429,
        500,
        502,
        503,
        504
      ]
    },
    "surface": "slack_webhook"
  },
  "event_count": 5,
  "events": [
    {
      "confidence": "confirmed",
      "detail_refs": {
        "model_refs": [
          "model:anthropic/claude-opus-4-1-20250805"
        ],
        "replacement_refs": [
          "model:anthropic/claude-opus-4-8"
        ]
      },
      "effective_at": null,
      "event_date": "2026-06-05",
      "event_kind": "model_retirement",
      "evidence_refs": [
        {
          "authority": "official_docs",
          "content_sha256": "bdb1c9f2a3da8f2bedeb0ef24a58aa07789f4a8a9608e97357a0690258b115bd",
          "retrieved_at": "2026-06-10T19:08:00Z",
          "source_key": "anthropic.release_notes",
          "url": "https://platform.claude.com/docs/en/release-notes/overview#june-5-2026"
        }
      ],
      "id": "2026-06-05-anthropic-opus-41-api-retirement",
      "impacts": [
        {
          "confidence": "confirmed",
          "direction": "removed",
          "impact_kind": "migration",
          "recommended_action": "Remove claude-opus-4-1-20250805 from production routing, eval baselines, fallback chains, and customer-visible model selectors before August 5, 2026.",
          "scope_ref": "surface:anthropic/api",
          "scope_type": "provider_surface",
          "severity": "high"
        }
      ],
      "lifecycle_status": "reviewed",
      "migration_deadline": "2026-08-05T00:00:00Z",
      "observed_at": "2026-06-10T19:08:00Z",
      "provider_refs": [
        "provider:anthropic"
      ],
      "severity": "high",
      "source_authority": "official_docs",
      "summary": "Anthropic's Claude Platform release notes announced deprecation of claude-opus-4-1-20250805 and scheduled Claude API retirement for August 5, 2026, with migration guidance toward newer Opus models.",
      "title": "Anthropic Scheduled Claude Opus 4.1 API Retirement For August 2026"
    },
    {
      "confidence": "confirmed",
      "detail_refs": {
        "model_refs": [
          "model:gemini-2.0-flash",
          "model:gemini-2.0-flash-001",
          "model:gemini-2.0-flash-lite",
          "model:gemini-2.0-flash-lite-001"
        ],
        "replacement_refs": [
          "model:gemini-3.1-flash-lite",
          "model:gemini-3.5-flash"
        ]
      },
      "effective_at": "2026-06-01T00:00:00Z",
      "event_date": "2026-06-01",
      "event_kind": "model_retirement",
      "evidence_refs": [
        {
          "authority": "official_docs",
          "content_sha256": "d4b0591379a8d6754e310483af146de01bdd01be458a3446d33e2860746a853d",
          "retrieved_at": "2026-06-08T11:04:15Z",
          "source_key": "google.gemini_changelog",
          "url": "https://ai.google.dev/gemini-api/docs/changelog"
        }
      ],
      "id": "2026-06-01-google-gemini-api-20-flash-shutdown",
      "impacts": [
        {
          "confidence": "confirmed",
          "direction": "removed",
          "impact_kind": "availability",
          "recommended_action": "Remove Gemini 2.0 Flash API model IDs from production routing, allowlists, and fallback chains.",
          "scope_ref": "surface:google/gemini-api",
          "scope_type": "provider_surface",
          "severity": "high"
        },
        {
          "confidence": "confirmed",
          "direction": "changed",
          "impact_kind": "migration",
          "recommended_action": "Audit logs and configs for retired Gemini API model IDs and move workloads to supported Gemini models.",
          "scope_ref": "surface:google/gemini-api",
          "scope_type": "provider_surface",
          "severity": "high"
        }
      ],
      "lifecycle_status": "reviewed",
      "migration_deadline": "2026-06-01T00:00:00Z",
      "observed_at": "2026-06-08T11:04:15Z",
      "provider_refs": [
        "provider:google"
      ],
      "severity": "high",
      "source_authority": "official_docs",
      "summary": "Google Gemini API changelog records the June 1, 2026 shutdown of Gemini 2.0 Flash and Gemini 2.0 Flash-Lite model IDs on the Gemini API surface.",
      "title": "Google Gemini API Shut Down Gemini 2.0 Flash Models"
    },
    {
      "confidence": "confirmed",
      "detail_refs": {
        "model_refs": [
          "model:gemini-2.0-flash-001",
          "model:gemini-2.0-flash-lite-001"
        ],
        "replacement_refs": [
          "model:gemini-2.5-flash",
          "model:gemini-2.5-flash-lite"
        ]
      },
      "effective_at": "2026-06-01T00:00:00Z",
      "event_date": "2026-06-01",
      "event_kind": "model_retirement",
      "evidence_refs": [
        {
          "authority": "official_docs",
          "content_sha256": "7d8656abd449c02462613fd1739193095e0f46ab01c3d0193935f4fd785f1bf5",
          "retrieved_at": "2026-06-01T10:36:49Z",
          "source_key": "google.vertex_model_versions",
          "url": "https://cloud.google.com/vertex-ai/generative-ai/docs/learn/model-versions"
        }
      ],
      "id": "2026-06-01-google-vertex-gemini-2-0-flash-retirement",
      "impacts": [
        {
          "confidence": "confirmed",
          "direction": "removed",
          "impact_kind": "availability",
          "recommended_action": "Audit Vertex AI model IDs and migrate workloads that still reference Gemini 2.0 Flash stable models.",
          "scope_ref": "surface:google/vertex-ai",
          "scope_type": "provider_surface",
          "severity": "medium"
        },
        {
          "confidence": "confirmed",
          "direction": "changed",
          "impact_kind": "migration",
          "recommended_action": "Refresh model allowlists, default model choices, and agent benchmarks to use supported Gemini stable models.",
          "scope_ref": "surface:google/vertex-ai",
          "scope_type": "provider_surface",
          "severity": "medium"
        }
      ],
      "lifecycle_status": "reviewed",
      "migration_deadline": "2026-06-01T00:00:00Z",
      "observed_at": "2026-06-01T10:36:49Z",
      "provider_refs": [
        "provider:google"
      ],
      "severity": "medium",
      "source_authority": "official_docs",
      "summary": "Google Vertex AI model-version documentation lists Gemini 2.0 Flash stable model IDs with a June 1, 2026 retirement date and points developers toward newer Gemini stable models.",
      "title": "Google Vertex AI Retires Gemini 2.0 Flash Stable Models"
    },
    {
      "confidence": "confirmed",
      "detail_refs": {
        "model_refs": [
          "model:gemini-3.1-flash-lite-preview"
        ],
        "replacement_refs": [
          "model:gemini-3.1-flash-lite"
        ]
      },
      "effective_at": "2026-05-25T00:00:00Z",
      "event_date": "2026-05-25",
      "event_kind": "model_retirement",
      "evidence_refs": [
        {
          "authority": "official_docs",
          "content_sha256": "d4b0591379a8d6754e310483af146de01bdd01be458a3446d33e2860746a853d",
          "retrieved_at": "2026-06-08T11:04:15Z",